{
  "$schema": "https://json-schema.org/draft/2020-12/schema",
  "$id": "https://csa.local/schema/active-validation-policy-1.0.json",
  "type": "object",
  "additionalProperties": false,
  "required": [
    "schemaVersion",
    "enabled",
    "allowedRiskLevels",
    "allowTemporarySystemChanges",
    "allowNetworkListeners",
    "allowOutboundNetworkTests",
    "allowLoopbackNetworkTests",
    "allowedTargetCidrs",
    "maximumValidatorsPerRun",
    "maximumTotalDurationSeconds",
    "defaultValidatorTimeoutSeconds",
    "requireExplicitAuthorization",
    "redactSensitivePaths",
    "retainRawEventData",
    "allowDeepResponderValidation",
    "allowNameResolutionResponses",
    "allowAuthenticationChallenges",
    "allowTemporaryNetworkListeners",
    "allowTemporaryFirewallChanges",
    "allowSyntheticCredentialFlow",
    "allowRealCredentialObservation",
    "allowCredentialMaterialRetention",
    "allowCredentialRelay",
    "allowHashCracking",
    "allowExternalTargets"
  ],
  "properties": {
    "schemaVersion": {"const": "1.0"},
    "enabled": {"type": "boolean"},
    "allowedRiskLevels": {
      "type": "array",
      "uniqueItems": true,
      "items": {"enum": ["SAFE_READ_ONLY", "LOW_IMPACT", "CONTROLLED_TEMPORARY_CHANGE"]}
    },
    "allowTemporarySystemChanges": {"type": "boolean"},
    "allowNetworkListeners": {"type": "boolean"},
    "allowOutboundNetworkTests": {"type": "boolean"},
    "allowLoopbackNetworkTests": {"type": "boolean"},
    "allowedTargetCidrs": {"type": "array", "items": {"type": "string"}},
    "maximumValidatorsPerRun": {"type": "integer", "minimum": 1, "maximum": 100},
    "maximumTotalDurationSeconds": {"type": "integer", "minimum": 1, "maximum": 3600},
    "defaultValidatorTimeoutSeconds": {"type": "integer", "minimum": 1, "maximum": 300},
    "requireExplicitAuthorization": {"const": true},
    "redactSensitivePaths": {"type": "boolean"},
    "retainRawEventData": {"const": false}
    ,"allowDeepResponderValidation": {"type": "boolean", "default": false}
    ,"allowNameResolutionResponses": {"type": "boolean", "default": false}
    ,"allowAuthenticationChallenges": {"type": "boolean", "default": false}
    ,"allowTemporaryNetworkListeners": {"type": "boolean", "default": false}
    ,"allowTemporaryFirewallChanges": {"type": "boolean", "default": false}
    ,"allowSyntheticCredentialFlow": {"type": "boolean", "default": false}
    ,"allowRealCredentialObservation": {"const": false}
    ,"allowCredentialMaterialRetention": {"const": false}
    ,"allowCredentialRelay": {"const": false}
    ,"allowHashCracking": {"const": false}
    ,"allowExternalTargets": {"const": false}
  }
}
