{
  "schemaVersion": "1.0",
  "enabled": true,
  "allowedRiskLevels": ["SAFE_READ_ONLY", "CONTROLLED_TEMPORARY_CHANGE"],
  "allowTemporarySystemChanges": true,
  "allowNetworkListeners": true,
  "allowOutboundNetworkTests": false,
  "allowLoopbackNetworkTests": false,
  "allowedTargetCidrs": [],
  "maximumValidatorsPerRun": 10,
  "maximumTotalDurationSeconds": 300,
  "defaultValidatorTimeoutSeconds": 30,
  "requireExplicitAuthorization": true,
  "redactSensitivePaths": true,
  "retainRawEventData": false,
  "allowDeepResponderValidation": true,
  "allowNameResolutionResponses": true,
  "allowAuthenticationChallenges": true,
  "allowTemporaryNetworkListeners": true,
  "allowTemporaryFirewallChanges": true,
  "allowSyntheticCredentialFlow": true,
  "allowRealCredentialObservation": false,
  "allowCredentialMaterialRetention": false,
  "allowCredentialRelay": false,
  "allowHashCracking": false,
  "allowExternalTargets": false
}
